{
  "$schema": "https://json-schema.org/draft/2020-12/schema",
  "title": "Experimental passive peripheral export 0.1",
  "description": "At most 65536 UTF-8 bytes and JSON depth 8. Custom validator also enforces expiresAtMs = generatedAtMs + 3000 * intervalSeconds, clock/freshness checks, and producer = installed source namespace.",
  "type": "object",
  "additionalProperties": false,
  "required": [
    "formatVersion",
    "producer",
    "producerVersion",
    "generatedAtMs",
    "expiresAtMs",
    "intervalSeconds",
    "devices"
  ],
  "properties": {
    "formatVersion": {
      "const": "0.1-experimental"
    },
    "producer": {
      "type": "string",
      "pattern": "^[a-z][a-z0-9-]{0,63}$"
    },
    "producerVersion": {
      "type": "string",
      "pattern": "^[A-Za-z0-9.+_-]{1,40}$"
    },
    "generatedAtMs": {
      "type": "integer",
      "minimum": 1,
      "maximum": 9007199254740991
    },
    "expiresAtMs": {
      "type": "integer",
      "minimum": 1,
      "maximum": 9007199254740991
    },
    "intervalSeconds": {
      "type": "integer",
      "minimum": 10,
      "maximum": 3600
    },
    "devices": {
      "type": "array",
      "maxItems": 128,
      "items": {
        "type": "object",
        "additionalProperties": false,
        "required": [
          "kind",
          "link",
          "present",
          "stale",
          "observedAtMs",
          "battery",
          "components"
        ],
        "properties": {
          "kind": {
            "enum": [
              "mouse",
              "keyboard",
              "earbuds",
              "headset",
              "touchpad",
              "gamepad",
              "other"
            ]
          },
          "link": {
            "enum": [
              "receiver",
              "bluetooth",
              "usb",
              "unknown"
            ]
          },
          "present": {
            "type": "boolean"
          },
          "stale": {
            "type": "boolean"
          },
          "observedAtMs": {
            "type": [
              "integer",
              "null"
            ],
            "minimum": 1,
            "maximum": 9007199254740991
          },
          "battery": {
            "type": "object",
            "additionalProperties": false,
            "required": [
              "percent",
              "level",
              "charging",
              "estimated"
            ],
            "properties": {
              "percent": {
                "type": [
                  "integer",
                  "null"
                ],
                "minimum": 0,
                "maximum": 100
              },
              "level": {
                "enum": [
                  "critical",
                  "low",
                  "good",
                  "full",
                  null
                ]
              },
              "charging": {
                "enum": [
                  "discharging",
                  "charging",
                  "full",
                  "unknown"
                ]
              },
              "estimated": {
                "type": "boolean"
              }
            }
          },
          "components": {
            "type": "array",
            "maxItems": 3,
            "items": {
              "type": "object",
              "additionalProperties": false,
              "required": [
                "label",
                "percent",
                "charging"
              ],
              "properties": {
                "label": {
                  "enum": [
                    "left",
                    "right",
                    "case"
                  ]
                },
                "percent": {
                  "type": [
                    "integer",
                    "null"
                  ],
                  "minimum": 0,
                  "maximum": 100
                },
                "charging": {
                  "enum": [
                    "discharging",
                    "charging",
                    "full",
                    "unknown"
                  ]
                }
              }
            },
            "allOf": [
              {
                "contains": {
                  "type": "object",
                  "required": [
                    "label"
                  ],
                  "properties": {
                    "label": {
                      "const": "left"
                    }
                  }
                },
                "minContains": 0,
                "maxContains": 1
              },
              {
                "contains": {
                  "type": "object",
                  "required": [
                    "label"
                  ],
                  "properties": {
                    "label": {
                      "const": "right"
                    }
                  }
                },
                "minContains": 0,
                "maxContains": 1
              },
              {
                "contains": {
                  "type": "object",
                  "required": [
                    "label"
                  ],
                  "properties": {
                    "label": {
                      "const": "case"
                    }
                  }
                },
                "minContains": 0,
                "maxContains": 1
              }
            ]
          }
        }
      }
    }
  }
}
