{"formatVersion":"0.1-experimental","producer":"perigauge","producerVersion":"0.1.0-alpha.3","generatedAtMs":1000125,"expiresAtMs":1090125,"intervalSeconds":30,"devices":[{"kind":"earbuds","link":"unknown","present":true,"stale":true,"observedAtMs":null,"battery":{"percent":null,"level":null,"charging":"unknown","estimated":false},"components":[{"label":"case","percent":80,"charging":"charging"}]}]}